<?xml version="1.0" encoding="UTF-8"?>
<PLUGIN_CONFIGURATION xmlns:xsi="http://www.w3.org/2001/XMLSchema-instance" xsi:noNamespaceSchemaLocation="schemas_plugins.xsd">
    <fileNamePattern>spa_satatt_jason2.txt</fileNamePattern>
    <compositeAttribute>
        <name>TIME_PERIOD</name>
        <order>1</order>
        <fixedValueAttribute>
            <fixedValue>2008-06-22T11:55:44</fixedValue>
            <specification>
                <name>START_DATE</name>
                <valueType>DATE_TIME</valueType>
                <formatRead>yyyy-MM-dd'T'HH:mm:ss</formatRead>
            </specification>
        </fixedValueAttribute>
        <attributeFromAsciiFile>
 	    <linePattern>.*([0-9]{4}-[0-9]{3}T[0-9]{2}:[0-9]{2}:[0-9]{2}).*([0-9]{3}).*([0-9]{3}).*</linePattern>
            <lineNumber>-2</lineNumber>
            <groupNumber>1</groupNumber>
            <specification>
                <name>STOP_DATE</name>
                <valueType>DATE_TIME</valueType>
                <formatRead>yyyy-DDD'T'HH:mm:ss</formatRead>
            </specification>
        </attributeFromAsciiFile>
    </compositeAttribute>
    <fileInfoAttribute>
        <fileInformation>LAST_MODIFICATION_DATE</fileInformation>
        <specification>
            <name>FILE_CREATION_DATE</name>
            <valueType>DATE_TIME</valueType>
            <order>3</order>
        </specification>
    </fileInfoAttribute>
</PLUGIN_CONFIGURATION>
